{
  "$schema": "https://json-schema.org/draft/2020-12/schema",
  "title": "LLMInjection vulnerability record",
  "type": "object",
  "required": [
    "id",
    "type",
    "name",
    "kind",
    "package",
    "ecosystem",
    "identifiers",
    "severity",
    "affected",
    "patched",
    "published",
    "confidence",
    "summary",
    "source_ids"
  ],
  "properties": {
    "id": {
      "type": "string",
      "pattern": "^VULN-"
    },
    "type": {
      "const": "vulnerability"
    },
    "name": {
      "type": "string"
    },
    "kind": {
      "type": "string"
    },
    "package": {
      "type": "string"
    },
    "ecosystem": {
      "type": "string"
    },
    "identifiers": {
      "type": "array",
      "minItems": 1,
      "items": {
        "type": "string"
      }
    },
    "severity": {
      "type": "string"
    },
    "affected": {
      "type": "array",
      "items": {
        "type": "string"
      }
    },
    "patched": {
      "type": "array",
      "items": {
        "type": "string"
      }
    },
    "published": {
      "type": "string",
      "format": "date"
    },
    "confidence": {
      "enum": [
        "confirmed",
        "high",
        "medium",
        "low",
        "unverified"
      ]
    },
    "summary": {
      "type": "string",
      "minLength": 20
    },
    "source_ids": {
      "type": "array",
      "minItems": 1,
      "items": {
        "type": "string",
        "pattern": "^SRC-"
      }
    }
  },
  "additionalProperties": false
}
